published_at_utc,date_day,title,url,domain,source,sourceCountry,language
2025-10-29T07:00:00+00:00,2025-10-29,Ông trùm Chen Zhi ở Campuchia bị Mỹ truy tố là ai ? - BBC News Tiếng Việt,https://www.bbc.com/vietnamese/articles/c4gwjrjxnejo,www.bbc.com,,,Vietnamese
2025-10-29T01:00:00+00:00,2025-10-29,Giá Pi Network hồi phục nhưng ngay lập tức gây thất vọng,https://dantri.com.vn/cong-nghe/gia-pi-network-hoi-phuc-nhung-ngay-lap-tuc-gay-that-vong-20251028155702419.htm,dantri.com.vn,,,Vietnamese
2025-10-29T02:30:00+00:00,2025-10-29,Quantum computing threat looms over Asia financial systems :  we are not secure,https://www.scmp.com/week-asia/economics/article/3330673/quantum-computing-threat-looms-over-asias-financial-systems-we-are-not-secure,www.scmp.com,,,English
2025-10-30T00:00:00+00:00,2025-10-29,Jim Cramer on Circle Internet :  Im Going to Bless It Right Here,https://finance.yahoo.com/news/jim-cramer-circle-internet-m-160233087.html,finance.yahoo.com,,,English
2025-10-29T16:00:00+00:00,2025-10-29,Биткоин может подорожать до $123 тысяч,https://forbes.kz/articles/bitkoin-mozhet-podorozhat-do123-tysyach,forbes.kz,,,Russian
2025-10-29T11:45:00+00:00,2025-10-29,Futuros de NY operam mistos à espera do Fed e balanços de big techs,https://www.infomoney.com.br/mercados/futuros-de-ny-operam-mistos-a-espera-do-fed-e-balancos-de-big-techs/,www.infomoney.com.br,,,Portuguese
2025-10-29T12:15:00+00:00,2025-10-29,Bitcoin Retreats to $112K as Institutional Demand Fades,https://biztoc.com/x/59db8c2feab709fc,biztoc.com,,,English
2025-10-29T03:45:00+00:00,2025-10-29,Asia Morning Briefing : Bitcoin Holds Ground as Traders Sit on Stablecoins Before Fed Decision,https://biztoc.com/x/3ed5726dce7434cd,biztoc.com,,,English
2025-10-29T16:45:00+00:00,2025-10-29,"Thị trường tiền số hôm nay , 29 - 10 : Chuyên gia cảnh báo rủi ro từ sàn giao dịch không phép",https://stockbiz.vn/tin-tuc/thi-truong-tien-so-hom-nay-29-10-chuyen-gia-canh-bao-rui-ro-tu-san-giao-dich-khong-phep/36420946,stockbiz.vn,,,Vietnamese
2025-10-29T11:30:00+00:00,2025-10-29,Krypto News : NASDAQ erreicht neues Allzeithoch - darum könnten Kryptos davon profitieren,https://www.finanzen.net/nachricht/devisen/krypto-news-nasdaq-erreicht-neues-allzeithoch-darum-koennten-kryptos-davon-profitieren-15138991,www.finanzen.net,,,German
2025-10-29T16:45:00+00:00,2025-10-29,"The Protocol : ETH Fusaka Upgrade Goes Live on Hoodi , Mainnet Next",https://biztoc.com/x/e65bf4a929dc7cb1,biztoc.com,,,English
2025-10-29T16:45:00+00:00,2025-10-29,"So entwickeln sich Bitcoin , Litecoin & Co am Mittwochnachmittag am Kryptomarkt",https://www.finanzen.net/nachricht/devisen/so-entwickeln-sich-bitcoin-litecoin-co-am-mittwochnachmittag-am-kryptomarkt-15141256,www.finanzen.net,,,German
2025-10-29T11:45:00+00:00,2025-10-29,TeraWulf Inc . Announces Proposed Private Offering of $500 million of Convertible Notes,https://www.manilatimes.net/2025/10/29/tmt-newswire/globenewswire/terawulf-inc-announces-proposed-private-offering-of-500-million-of-convertible-notes/2211017,www.manilatimes.net,,,English
2025-10-29T10:45:00+00:00,2025-10-29,CreditBlockchain launches AI - assisted cloud mining platform for cryptocurrency enthusiasts,https://www.fxstreet.com/press-releases/creditblockchain-launches-ai-assisted-cloud-mining-platform-for-cryptocurrency-enthusiasts-202510291024,www.fxstreet.com,,,English
2025-10-30T00:00:00+00:00,2025-10-29,Why the Official Trump Cryptocurrency Is Skyrocketing Today,https://www.fool.com/investing/2025/10/29/why-the-official-trump-cryptocurrency-is-skyrocket/?source=iedfolrf0000001,www.fool.com,,,English
2025-10-29T22:30:00+00:00,2025-10-29,코인  거품론  일축한 두나무 대표 … 버블은 진화의 통과의례,https://www.hankookilbo.com:443/News/Read/A2025102916090001391,www.hankookilbo.com:443,,,Korean
2025-10-29T07:00:00+00:00,2025-10-29,"KB증권 ,  오늘의 콕  올해 누적 조회수 1000만 돌파",https://www.newspim.com/news/view/20251029001134,www.newspim.com,,,Korean
2025-10-29T11:45:00+00:00,2025-10-29,El IBEX logra nuevo récord histórico y alcanza los 16 . 100 puntos,https://efe.com/economia/2025-10-29/ibex-record-historico-bolsa/,efe.com,,,Spanish
2025-10-29T14:45:00+00:00,2025-10-29,TeraWulf ( WULF ) Hits New All - Time High on New $9 . 5 - Billion Fluidstack Deal,https://www.insidermonkey.com/blog/terawulf-wulf-hits-new-all-time-high-on-new-9-5-billion-fluidstack-deal-1636070/,www.insidermonkey.com,,,English
2025-10-29T02:45:00+00:00,2025-10-29,Tiền kỹ thuật số tái định hình hệ thống tiền tệ,https://baomoi.com/tien-ky-thuat-so-tai-dinh-hinh-he-thong-tien-te-c53613452.epi,baomoi.com,,,Vietnamese
2025-10-29T11:45:00+00:00,2025-10-29,Bir milyar dolarlık sır : Trump ailesinin kripto imparatorluğu,"https://www.ntv.com.tr/dunya/bir-milyar-dolarlik-sir-trump-ailesinin-kripto-imparatorlugu,As5Jg_cHk0aw8sN9RysVoA",www.ntv.com.tr,,,Turkish
2025-10-29T05:00:00+00:00,2025-10-29,LIBERTY CARIBBEAN WORKING WITH STARLINK DIRECT TO CELL TO PROVIDE EMERGENCY SERVICE IN JAMAICA DURING HURRICANE MELISSA AFTERMATH,https://www.marketscreener.com/news/liberty-caribbean-working-with-starlink-direct-to-cell-to-provide-emergency-service-in-jamaica-durin-ce7d5dddda8ffe2d,www.marketscreener.com,,,English
2025-10-29T16:45:00+00:00,2025-10-29,"CRCL Down 2 %, But Circle USDC Outgrows USDT Under Trump - Backed GENIUS Act - Circle Internet Group ( NYSE : CRCL )",https://www.benzinga.com/crypto/cryptocurrency/25/10/48501640/crcl-down-2-but-circles-usdc-outgrows-usdt-under-trump-backed-genius-act,www.benzinga.com,,,English
2025-10-29T05:45:00+00:00,2025-10-29,Solana ( SOL ) Weakens Again Break Below $200 Opens Door For Further Decline,https://www.newsbtc.com/analysis/solana-sol-weakens-200/,www.newsbtc.com,,,English
2025-10-29T16:45:00+00:00,2025-10-29,"So entwickeln sich Bitcoin , Litecoin & Co am Mittwochnachmittag am Kryptomarkt",https://www.finanzen.ch/nachrichten/devisen/so-entwickeln-sich-bitcoin-litecoin-&-co-am-mittwochnachmittag-am-kryptomarkt-1035448346,www.finanzen.ch,,,German
2025-10-29T20:15:00+00:00,2025-10-29,At the Peak of the x402 Boom : Gold Rush or Hidden Risk ?,https://www.manilatimes.net/2025/10/30/tmt-newswire/globenewswire/at-the-peak-of-the-x402-boom-gold-rush-or-hidden-risk/2211519,www.manilatimes.net,,,English
2025-10-29T04:30:00+00:00,2025-10-29,Aplikasi Bitcoin Relai Asal Swiss Dapatkan Lisensi MiCA di Prancis,https://www.antaranews.com/berita/5206009/aplikasi-bitcoin-relai-asal-swiss-dapatkan-lisensi-mica-di-prancis,www.antaranews.com,,,Indonesian
2025-10-29T00:45:00+00:00,2025-10-29,"MEXC New CSO Cecilia Hsueh on Exchange Strategy , RWA Hype , and Why  Doing Les Works",https://finance.yahoo.com/news/mexc-cso-cecilia-hsueh-exchange-123215649.html,finance.yahoo.com,,,English
2025-10-29T13:45:00+00:00,2025-10-29,Bu adaya gidenlere çip takıyorlar !  Milyarderlerin şehri  bilim kurgu filmlerini aratmıyor !,https://www.sozcu.com.tr/bu-adaya-gidenlere-cip-takiyorlar-milyarderlerin-sehri-bilim-kurgu-filmlerini-aratmiyor-p253709,www.sozcu.com.tr,,,Turkish
2025-10-29T15:15:00+00:00,2025-10-29,HKEX CEO : Stock exchanges must band together to stay relevant,https://fortune.com/2025/10/29/hkex-ceo-bonnie-chan-stock-exchanges-crypto/,fortune.com,,,English
2025-10-29T11:30:00+00:00,2025-10-29,Grayscale Solana Trust ETF ( Ticker : GSOL ) Launches on NYSE Arca with Staking,https://www.manilatimes.net/2025/10/29/tmt-newswire/globenewswire/grayscale-solana-trust-etf-ticker-gsol-launches-on-nyse-arca-with-staking/2210995,www.manilatimes.net,,,English
2025-10-29T16:00:00+00:00,2025-10-29,Deepsnitch AI Price Prediction 2025 – 2030,https://www.coinspeaker.com/guides/deepsnitch-ai-price-prediction/,www.coinspeaker.com,,,English
2025-10-29T05:45:00+00:00,2025-10-29,Dogecoin Price Struggles at $0 . 20 Support Amid Whale Selloff and Futures Liquidations,https://www.newsbtc.com/news/dogecoin/dogecoin-price-struggles-at-0-20-support-amid-whale-selloff-and-futures-liquidations/,www.newsbtc.com,,,English
2025-10-29T04:15:00+00:00,2025-10-29,Strategy Earnings : What To Look For From MSTR,https://markets.financialcontent.com/stocks/article/stockstory-2025-10-29-strategy-earnings-what-to-look-for-from-mstr,markets.financialcontent.com,,,English
2025-10-29T21:00:00+00:00,2025-10-29,5 Things to Know Before the Stock Market Opens,https://finance.yahoo.com/news/5-things-know-stock-market-121555977.html,finance.yahoo.com,,,English
2025-10-29T05:45:00+00:00,2025-10-29,XRP Price Softens Momentum Weakness Could Limit Upside In Near Term,https://www.newsbtc.com/analysis/xrp/xrp-price-softens-2-60/,www.newsbtc.com,,,English
2025-10-29T02:45:00+00:00,2025-10-29,Bitcoin nach Rekordhoch und Einbruch : So sehen Experten die Entwicklung bis 2026,https://www.finanzen.ch/nachrichten/devisen/bitcoin-nach-rekordhoch-und-einbruch-so-sehen-experten-die-entwicklung-bis-2026-1035438018,www.finanzen.ch,,,German
2025-10-29T08:00:00+00:00,2025-10-29,"Ether Price Analysis : ETH Holding Above $4K , Arkham Says  BitMine Is Buying the Dip",https://www.coindesk.com/markets/2025/10/29/ether-holds-above-usd4-000-arkham-says-tom-lee-s-bitmine-is-buying-the-dip,www.coindesk.com,,,English
2025-10-29T17:00:00+00:00,2025-10-29,Bittam Exchange Launches 200× Leverage Trading with Zero Funding Fees and Instant No - KYC Access and＄300 welcome bonus,https://portal.sina.com.hk/finance/finance-globenewswire/globenewswire/2025/10/29/1361325/bittam-exchange-launches-200x-leverage-trading-with-zero-funding-fees-and-instant-no-kyc-access-and%EF%BC%84300-welcome-bonus/,portal.sina.com.hk,,,English
2025-10-29T05:00:00+00:00,2025-10-29,LiveNews . co . nz | Page 1227,https://livenews.co.nz/page/1227/,livenews.co.nz,,,English
2025-10-29T01:15:00+00:00,2025-10-29,LiveNews . co . nz | Page 1225,https://livenews.co.nz/page/1225/,livenews.co.nz,,,English
2025-10-29T08:30:00+00:00,2025-10-29,LiveNews . co . nz | Page 1228,https://livenews.co.nz/page/1228/,livenews.co.nz,,,English
2025-10-29T20:30:00+00:00,2025-10-29,Crash bei Dogecoin ? DAS spricht jetzt dafür,https://www.finanzen.net/nachricht/devisen/crash-bei-dogecoin-das-spricht-jetzt-dafuer-15142370,www.finanzen.net,,,German
2025-10-29T07:45:00+00:00,2025-10-29,顶级经济学家警告 ： 比特币的下一步走势可能会重创黄金多头 ！_ 金市直播 _ 黄金网 _ 中金在线,http://gold.cnfol.com/jinshizhibo/20251029/31746847.shtml,gold.cnfol.com,,,Chinese
2025-10-29T16:00:00+00:00,2025-10-29,Bittam Exchange Launches 200× Leverage Trading with Zero Funding Fees and Instant No - KYC Access and＄300 welcome bonus,https://www.manilatimes.net/2025/10/29/tmt-newswire/globenewswire/bittam-exchange-launches-200-leverage-trading-with-zero-funding-fees-and-instant-no-kyc-access-and300-welcome-bonus/2211420,www.manilatimes.net,,,English
2025-10-29T12:15:00+00:00,2025-10-29,Here Why the Crypto Market is Going Down Ahead of Fed Decision,https://www.banklesstimes.com/articles/2025/10/29/heres-why-the-crypto-market-is-going-down-ahead-of-fed-decision/,www.banklesstimes.com,,,English
2025-10-29T17:00:00+00:00,2025-10-29,"Guggenheim Initiates Coverage of MARA Holdings ( MARA ) with Neutral Rating , Cites Strong Bitcoin Price Correlation , Need for Strategic Clarity",https://biztoc.com/x/8b19de5785fd0d26,biztoc.com,,,English
2025-10-29T13:00:00+00:00,2025-10-29,"Bitcoin , Ethereum , XRP , Dogecoin Wobble On Wednesday Ahead Of FOMC Meeting",https://biztoc.com/x/ddeb0dbda1186846,biztoc.com,,,English
2025-10-29T10:00:00+00:00,2025-10-29,"DBS , Goldman Sachs Execute First Over - the - Counter Interbank Crypto Options Trade",https://biztoc.com/x/f11d4cc8b6c26e0e,biztoc.com,,,English
2025-10-29T17:00:00+00:00,2025-10-29,"Michael Saylor Strategy Drops $18B in Value , but a Rebound May Be Near : 10X Research",https://biztoc.com/x/ec8587c1ec412798,biztoc.com,,,English
2025-10-29T13:00:00+00:00,2025-10-29,5 Things to Know Before the Stock Market Opens,https://finance.yahoo.com/news/5-things-know-stock-market-121657078.html,finance.yahoo.com,,,English
2025-10-29T16:45:00+00:00,2025-10-29,Bitcoin Miner TeraWulf Aims to Raise $575 Million to Fund Google - Backed AI Ambitions,https://biztoc.com/x/4f5832c9877076be,biztoc.com,,,English
2025-10-29T21:45:00+00:00,2025-10-29,Altın fiyatları düşecek mi ? Gram altında yeni kritik seviye belli oldu,https://www.haberekspres.com.tr/altin-fiyatlari-dusecek-mi-gram-altinda-yeni-kritik-seviye-belli-oldu,www.haberekspres.com.tr,,,Turkish
2025-10-29T19:00:00+00:00,2025-10-29,Fed Delivers Expected 25 Basis Point Rate Cut as Markets Await Powell Comments,https://biztoc.com/x/fe7541958d18c330,biztoc.com,,,English
2025-10-29T16:45:00+00:00,2025-10-29,I Asked ChatGPT To Provide the Perfect Balanced Portfolio Here What It Said,https://finance.yahoo.com/news/asked-chatgpt-perfect-balanced-portfolio-161808225.html,finance.yahoo.com,,,English
2025-10-29T06:00:00+00:00,2025-10-29,"4000피  열풍에 나도 한 번 ?… 투자 뛰어든 MZ세대 ,  FOMO  일까",https://www.news1.kr/society/incident-accident/5957543,www.news1.kr,,,Korean
2025-10-29T19:30:00+00:00,2025-10-29,What Is Elon Musk New Grokipedia ?,https://www.dailydot.com/news/elon-musk-launches-grokipedia/,www.dailydot.com,,,English
2025-10-29T17:45:00+00:00,2025-10-29,"ASX 200 LIVE : ASX futures flat , Nvidia provides pre - Fed lift to Wall St",https://www.afr.com/markets/equity-markets/asx-futures-flat-nvidia-provides-pre-fed-lift-to-wall-st-20251030-p5n6dd,www.afr.com,,,English
2025-10-29T01:45:00+00:00,2025-10-29,Amerika në kërkim të sistemit të ri financiar global : Nga Bretton Woods te Epoka e Kriptomonedhave,https://albeu.com/teknologji/amerika-ne-kerkim-te-sistemit-te-ri-financiar-global-nga-bretton-woods-te-epoka-e-kriptomonedhave/833221/,albeu.com,,,Albanian
2025-10-29T18:15:00+00:00,2025-10-29,Markets Hold Breath : Fed Rate Cut Anticipated as Investors Scrutinize Powell Every Word,https://markets.financialcontent.com/stocks/article/marketminute-2025-10-29-markets-hold-breath-fed-rate-cut-anticipated-as-investors-scrutinize-powells-every-word,markets.financialcontent.com,,,English
2025-10-29T16:00:00+00:00,2025-10-29,"21Shares Files S - 1 to Debut HYPE ETF , Comeback Soon ?",https://www.coinspeaker.com/21shares-files-s-1-to-debut-hype-etf-comeback-soon/,www.coinspeaker.com,,,English
2025-10-29T11:45:00+00:00,2025-10-29,"오경석 두나무 대표  블록체인 , 한국 새로운 금융 질서 이끌 기회",http://www.newstomato.com/ReadNews.aspx?no=1279625,www.newstomato.com,,,Korean
2025-10-29T07:45:00+00:00,2025-10-29,Криптоброкер Короленко : Россия входит в тройку лидеров глобальных криптовалютных рынков,https://tass.ru/interviews/25473897,tass.ru,,,Russian
2025-10-29T19:30:00+00:00,2025-10-29,The Dollar Without Washington : Decentralizing Global Finance,https://observer.com/2025/10/the-dollar-without-washington/,observer.com,,,English
2025-10-29T19:15:00+00:00,2025-10-29,"Cursul euro stagnează în jurul pragului de 5 , 08 lei","https://www.viata-libera.ro/economie/251953-cursul-euro-stagneaza-in-jurul-pragului-de-5,08-lei",www.viata-libera.ro,,,Romanian
2025-10-29T01:45:00+00:00,2025-10-29,Local News : County commissioners look to revise noise resolution ( 10 / 28 / 25 ),http://www.fstribune.com/story/3065182.html,www.fstribune.com,,,English
2025-10-29T12:15:00+00:00,2025-10-29,AUD / USD Forecast : Soars as Strong CPI Dampens RBA Rate Cut Hopes,https://www.forexcrunch.com/blog/2025/10/29/aud-usd-forecast-soars-as-strong-cpi-dampens-rba-rate-cut-hopes/,www.forexcrunch.com,,,English
2025-10-29T07:45:00+00:00,2025-10-29,The best investing recommendations for the current market environment,https://finance.yahoo.com/news/best-investing-recommendations-current-market-200223504.html,finance.yahoo.com,,,English
2025-10-29T18:15:00+00:00,2025-10-29,Tallinn Black Nights celebrates regional creativity with its expanded Baltic Competition,https://cineuropa.org/en/newsdetail/485325/,cineuropa.org,,,English
2025-10-29T00:45:00+00:00,2025-10-29,"Litecoin ( LTC ) Price Prediction : LTC Breaks Out From Triangle Pattern , Targets $150 Rally Ahead",https://bravenewcoin.com/insights/litecoin-ltc-price-prediction-ltc-breaks-out-from-triangle-pattern-targets-150-rally-ahead,bravenewcoin.com,,,English
2025-10-29T09:30:00+00:00,2025-10-29,Raymond James Q3 Earnings Call : Our Top 5 Analyst Questions,https://markets.financialcontent.com/stocks/article/stockstory-2025-10-29-raymond-jamess-q3-earnings-call-our-top-5-analyst-questions,markets.financialcontent.com,,,English
2025-10-29T12:00:00+00:00,2025-10-29,Views from the nation press,https://www.timescall.com/2025/10/29/views-from-the-nations-press-375/,www.timescall.com,,,English
2025-10-29T11:45:00+00:00,2025-10-29,Bitcoin Drops While Gold Rebounds,https://www.rttnews.com/3587381/bitcoin-drops-while-gold-rebounds.aspx,www.rttnews.com,,,English
2025-10-29T18:15:00+00:00,2025-10-29,HKEX Charts a Digital Future : Navigating the Crypto Era with Strategic Innovation,https://markets.financialcontent.com/stocks/article/marketminute-2025-10-29-hkex-charts-a-digital-future-navigating-the-crypto-era-with-strategic-innovation,markets.financialcontent.com,,,English
2025-10-29T22:30:00+00:00,2025-10-29,Date Announced For New Student Center Grand Opening,https://www.northwestmoinfo.com/local-news/date-announced-for-new-student-center-grand-opening/,www.northwestmoinfo.com,,,English
2025-10-29T17:15:00+00:00,2025-10-29,Velcan SA : First Half Results,https://www.finanznachrichten.de/nachrichten-2025-10/66827338-velcan-sa-first-half-results-399.htm,www.finanznachrichten.de,,,English
2025-10-29T12:00:00+00:00,2025-10-29,Семья Трампа заработала 800 миллионов долларов на криптовалютах : инвестиции привлекались из разных стран,https://pda.kp.ru/online/news/6644503/,pda.kp.ru,,,Russian
2025-10-29T00:15:00+00:00,2025-10-29,"Říkal to už Koperník . Peníze ztrácí hodnotu , což rozvrací státy . Investoři jdou po zlatě a bitcoinu",https://archiv.hn.cz/c1-67805960-rikal-to-uz-kopernik-penize-ztraci-hodnotu-coz-rozvraci-staty-investori-jdou-po-zlate-a-bitcoinu,archiv.hn.cz,,,Czech
2025-10-29T01:15:00+00:00,2025-10-29,Stocks Rally on US - China Preliminary Trade Agreement,https://finance.yahoo.com/news/stocks-rally-us-china-preliminary-141001866.html,finance.yahoo.com,,,English
2025-10-29T01:15:00+00:00,2025-10-29,卡位新經濟 ！ 數位資產年交易破16兆美元 台灣穩定幣準備起跑 | 財經 | 三立新聞網 SETN . COM,https://www.setn.com/News.aspx?NewsID=1743404,www.setn.com,,,Chinese
2025-10-29T19:00:00+00:00,2025-10-29,Doug Ford calls on U . S . ambassador to apologize for profane rant,https://nationalpost.com/news/canada/doug-ford-pete-hoekstra-ontario-tirade,nationalpost.com,,,English
2025-10-29T15:15:00+00:00,2025-10-29,Дуров объявил о запуске своей новой сети : система имеет функции ИИ,https://pda.kp.ru/online/news/6644960/,pda.kp.ru,,,Russian
2025-10-29T16:45:00+00:00,2025-10-29,Ahead of Market : 10 things that will decide stock market action on Thursday,https://economictimes.indiatimes.com/markets/stocks/news/ahead-of-market-10-things-that-will-decide-stock-market-action-on-thursday/articleshow/124908737.cms,economictimes.indiatimes.com,,,English
2025-10-29T07:00:00+00:00,2025-10-29,The 7 Banking And Fintech Trends That Will Define 2026,https://www.forbes.com/sites/bernardmarr/2025/10/29/the-7-banking-and-fintech-trends-that-will-define-2026/,www.forbes.com,,,English
2025-10-29T11:45:00+00:00,2025-10-29,Solana Kurs Prognose : Muss man 2025 bereits abhaken ?,https://www.finanzen.ch/nachrichten/devisen/solana-kurs-prognose-muss-man-2025-bereits-abhaken-1035446599,www.finanzen.ch,,,German
2025-10-29T19:30:00+00:00,2025-10-29,Adam Triggs | Why wealth taxes fail in theory and practice | The Canberra Times,https://www.canberratimes.com.au/story/9099636/adam-triggs-why-wealth-taxes-fail-in-theory-and-practice/,www.canberratimes.com.au,,,English
2025-10-29T07:45:00+00:00,2025-10-29,Appointment of Léo Mercier as Bittensor Strategist | Company Announcement,https://www.investegate.co.uk/announcement/rns/astrid-intelligence-plc--astr/appointment-of-l-o-mercier-as-bittensor-strategist/9200489,www.investegate.co.uk,,,English
2025-10-29T05:00:00+00:00,2025-10-29,Catastrophic  hack underscores US public defender security gaps,https://www.thestar.com.my/tech/tech-news/2025/10/29/catastrophic-hack-underscores-us-public-defender-security-gaps,www.thestar.com.my,,,English
2025-10-29T13:00:00+00:00,2025-10-29,"Luckily , I did not mix our finance : My husband is 7 years younger and has dementia . What happens now ?",https://www.morningstar.com/news/marketwatch/20251029123/luckily-i-did-not-mix-our-finances-my-husband-is-7-years-younger-and-has-dementia-what-happens-now,www.morningstar.com,,,English
2025-10-29T00:00:00+00:00,2025-10-29,"[ 글로벌마켓 모닝 브리핑 ] 뉴욕증시 , 엔비디아發 AI 낙관론에 사상 최고치 … 금값 , 4000달러 밑돌아",https://www.etoday.co.kr/news/view/2519413,www.etoday.co.kr,,,Korean
2025-10-29T17:45:00+00:00,2025-10-29,Gearing up for appeal : Standard Bank v Sarb and the crypto contradiction,https://www.bizcommunity.com/article/gearing-up-for-appeal-standard-bank-v-sarb-and-the-crypto-contradiction-171336a,www.bizcommunity.com,,,English
2025-10-29T19:30:00+00:00,2025-10-29,Adam Triggs | Why wealth taxes fail in theory and practice | The Standard,https://www.standard.net.au/story/9099636/adam-triggs-why-wealth-taxes-fail-in-theory-and-practice/,www.standard.net.au,,,English
2025-10-29T21:00:00+00:00,2025-10-29,Instant withdrawal and fast payout casino sites united states 2025,https://timesofmalta.com/article/instant-withdrawal-fast-payout-casino-sites-usa-2025-a2.1118721,timesofmalta.com,,,English
2025-10-29T09:15:00+00:00,2025-10-29,Bazylewicz : Bonanza w Białym Domu • Krytyka Polityczna,https://krytykapolityczna.pl/swiat/usa-trump-nepotyzm-korupcja/,krytykapolityczna.pl,,,Polish
2025-10-29T06:30:00+00:00,2025-10-29,Catastrophic  Hack Underscores Public Defender Security Gaps,https://www.insurancejournal.com/news/national/2025/10/29/845466.htm,www.insurancejournal.com,,,English
2025-10-29T19:00:00+00:00,2025-10-29,Adam Triggs | Why wealth taxes fail in theory and practice | Illawarra Mercury,https://www.illawarramercury.com.au/story/9099636/adam-triggs-why-wealth-taxes-fail-in-theory-and-practice/,www.illawarramercury.com.au,,,English
2025-10-29T02:30:00+00:00,2025-10-29,"Tai nạn trên cao tốc Đà Nẵng - Quảng Ngãi trong đêm , nhiều hành khách bị thương",https://danviet.vn/tai-nan-tren-cao-toc-da-nang--quang-ngai-trong-dem-nhieu-hanh-khach-bi-thuong-d1374189.html,danviet.vn,,,Vietnamese
2025-10-29T21:00:00+00:00,2025-10-29,A word from our sponsors : Western Kenosha County Senior Citizens Council seeking Senior Center Program Director – West of the I,https://www.westofthei.com/2025/10/29/a-word-from-our-sponsors-western-kenosha-county-senior-citizens-council-seeking-senior-center-program-director-3/105298,www.westofthei.com,,,English
2025-10-29T02:30:00+00:00,2025-10-29,"Deaths Oct . 28 , 2025 : Jack Ogren – West of the I",https://www.westofthei.com/2025/10/28/deaths-oct-28-2025-jack-ogren/105366,www.westofthei.com,,,English
2025-10-29T16:00:00+00:00,2025-10-29,"Agenda : Salem School District board special meeting Oct . 29 , 2025 – West of the I",https://www.westofthei.com/2025/10/29/agenda-salem-school-district-board-special-meeting-oct-29-2025/105370,www.westofthei.com,,,English
2025-10-29T14:45:00+00:00,2025-10-29,Want to be your own boss ? Two stores in Barrie are for sale,https://www.simcoe.com/business/want-to-be-your-own-boss-2-convenience-stores-in-barrie-for-sale-here-s/article_4f6a9545-373d-5e7d-9c76-a497f37e1864.html,www.simcoe.com,,,English
2025-10-29T19:15:00+00:00,2025-10-29,"Fed Cuts 25bps , Ends QT As Expected ; Two FOMC Officials Dissent",https://www.zerohedge.com/markets/fomc-31,www.zerohedge.com,,,English
2025-10-29T00:15:00+00:00,2025-10-29,Cận cảnh khu ký túc xá sắp biến thành nhà ở xã hội tại cửa ngõ phía nam Hà Nội,https://danviet.vn/can-canh-khu-ky-tuc-xa-sap-bien-thanh-nha-o-xa-hoi-tai-cua-ngo-phia-nam-ha-noi-d1374153.html,danviet.vn,,,Vietnamese
2025-10-29T02:30:00+00:00,2025-10-29,"Trực tiếp Kỳ họp thứ 10 , Quốc hội Khóa XV ngày 29 / 10",https://danviet.vn/truc-tiep-ky-hop-thu-10-quoc-hoi-khoa-xv-ngay-29-10-d1374184.html,danviet.vn,,,Vietnamese
2025-10-29T14:45:00+00:00,2025-10-29,The Importance Of Crypto Literacy In 2025,https://investinglive.com:443/Education/the-importance-of-crypto-literacy-in-2025-20251029/,investinglive.com:443,,,English
2025-10-29T01:45:00+00:00,2025-10-29,Securitize $1 . 25B SPAC Bet : Tokenizing Wall Street Future,https://www.webpronews.com/securitizes-1-25b-spac-bet-tokenizing-wall-streets-future/,www.webpronews.com,,,English
2025-10-29T13:00:00+00:00,2025-10-29,Markets Await Central Bank Decisions,https://www.rttnews.com/story.aspx?Id=3587518,www.rttnews.com,,,English
2025-10-29T03:00:00+00:00,2025-10-29,Đồng euro kỹ thuật số dự kiến được phát hành vào năm 2029,https://stockbiz.vn/tin-tuc/dong-euro-ky-thuat-so-du-kien-duoc-phat-hanh-vao-nam-2029/36395093,stockbiz.vn,,,Vietnamese
2025-10-29T20:30:00+00:00,2025-10-29,Solana Kursprognose 2025 : Durchbruch oder Stagnation ?,https://www.boersennews.de/nachrichten/partner/clickout-media/solana-kursprognose-2025-durchbruch-oder-stagnation/4933635/,www.boersennews.de,,,German
