published_at_utc,date_day,title,url,domain,source,sourceCountry,language
2025-10-28T00:15:00+00:00,2025-10-28,Diskussion • Hyperscale Data • Forum,https://www.boersennews.de/community/diskussion/hyperscale-data/97661/,www.boersennews.de,,,English
2025-10-28T13:45:00+00:00,2025-10-28,"США хотят усложнить торговлю России , избежав скачка цен на нефть",https://forbes.kz/articles/ssha-hotyat-uslozhnit-torgovlyu-rossii-izbezhav-skachka-tsen-naneft,forbes.kz,,,Russian
2025-10-28T23:45:00+00:00,2025-10-28,TeraWulf ( WULF ) News : Google - Backed HPC Deal Sends Stock Sharply Higher,https://www.coindesk.com/business/2025/10/28/terawulf-stock-surges-22-after-usd9-5b-google-backed-ai-compute-deal-with-fluidstack,www.coindesk.com,,,English
2025-10-28T03:30:00+00:00,2025-10-28,"[ 출근길 뉴스프레소 ] 퀄컴 , AI칩 경쟁 참전 … 11 % 폭등 / 미중합의  순풍  / 구글 , 원전 재가동 · AMD · 에너지 협력  전력확보 전쟁  / 금 $4천 하회",https://www.mt.co.kr/stock/2025/10/28/2025102810117021039,www.mt.co.kr,,,Korean
2025-10-28T12:15:00+00:00,2025-10-28,"Coinbase Says Bitcoin Treasuries Are  Ghosting , But Two Firms Just Bought $205M",https://biztoc.com/x/8126725a9d976f70,biztoc.com,,,English
2025-10-28T12:15:00+00:00,2025-10-28,"1 Top Cryptocurrency to Buy Before It Soars 18 , 200 %, According to Strategy Chief and Billionaire Michael Saylor",https://biztoc.com/x/8b4fd5c78fab1498,biztoc.com,,,English
2025-10-28T17:45:00+00:00,2025-10-28,DefiMiner Cloud Mining Platform : AI and Quantum Computing Enhance the Future of Mining,https://www.pr.com/press-release/951622,www.pr.com,,,English
2025-10-28T16:45:00+00:00,2025-10-28,Jim Cramer on Circle Internet :  Im Going to Bless It Right Here,https://www.insidermonkey.com/blog/jim-cramer-on-circle-internet-im-going-to-bless-it-right-here-1635007/,www.insidermonkey.com,,,English
2025-10-28T19:15:00+00:00,2025-10-28,Vladislav Ginzburg to Newsmax : US Leadership Driving Bitcoin Strength | WCOA News Talk 104 . 9 FM and 1370 AM,https://www.wcoapensacola.com/2025/10/28/vladislav-ginzburg-to-newsmax-us-leadership-driving-bitcoins-strength/,www.wcoapensacola.com,,,English
2025-10-28T12:15:00+00:00,2025-10-28,Bitcoin mining firm subleases Platte St . office space from tech firm,https://businessden.com/2025/10/28/riot-platforms-sublease-denver-velocity-global-pebl/,businessden.com,,,English
2025-10-28T18:45:00+00:00,2025-10-28,Ultimate HTF Signal ? JP Morgan Greenlight Ethereum as Loan Collateral : Only Up From Here For ETH USD ?,https://finance.yahoo.com/news/ultimate-htf-signal-jp-morgan-093309518.html,finance.yahoo.com,,,English
2025-10-28T23:45:00+00:00,2025-10-28,"Shipping Firm OceanPal Pivots to AI With $120M PIPE Deal , Eyes 10 % of NEAR Supply",https://www.coindesk.com/business/2025/10/28/shipping-firm-oceanpal-adds-ai-arm-with-usd120m-pipe-deal-eyes-10-of-near-supply,www.coindesk.com,,,English
2025-10-28T12:15:00+00:00,2025-10-28,So entwickeln sich Bitcoin & Co . am Mittag,https://www.finanzen.net/nachricht/devisen/so-entwickeln-sich-bitcoin-co-am-mittag-15131484,www.finanzen.net,,,German
2025-10-28T23:15:00+00:00,2025-10-28,"US Unlocked Launches in Australia , Giving Consumers Seamless Access to US Online Shopping",https://www.manilatimes.net/2025/10/29/tmt-newswire/globenewswire/us-unlocked-launches-in-australia-giving-consumers-seamless-access-to-us-online-shopping/2210675,www.manilatimes.net,,,English
2025-10-28T19:00:00+00:00,2025-10-28,Stablecoins are a shaky proposition for your savings . Here what to know .,https://www.morningstar.com/news/marketwatch/20251028143/stablecoins-are-a-shaky-proposition-for-your-savings-heres-what-to-know,www.morningstar.com,,,English
2025-10-28T10:15:00+00:00,2025-10-28,Futuros de NY rondam estabilidade após recordes e na véspera da decisão do Fed,https://www.infomoney.com.br/mercados/futuros-de-ny-rondam-estabilidade-apos-recordes-e-na-vespera-da-decisao-do-fed/,www.infomoney.com.br,,,Portuguese
2025-10-28T09:15:00+00:00,2025-10-28,"Bitcoin , Ether & Co : So schlagen sich die Kryptowährungen am Dienstagvormittag",https://www.finanzen.net/nachricht/devisen/bitcoin-ether-co-so-schlagen-sich-die-kryptowaehrungen-am-dienstagvormittag-15130504,www.finanzen.net,,,German
2025-10-28T01:00:00+00:00,2025-10-28,Ny studie kartlegger direktesendte overgrep mot barn : – Toppen av isfjellet,https://www.forskning.no/barn-og-ungdom-internett-kriminalitet/ny-studie-kartlegger-direktesendte-overgrep-mot-barn-toppen-av-isfjellet/2566862,www.forskning.no,,,Norwegian
2025-10-28T12:15:00+00:00,2025-10-28,So entwickeln sich Bitcoin & Co . am Mittag,https://www.finanzen.ch/nachrichten/devisen/so-entwickeln-sich-bitcoin-&-co-am-mittag-1035438361,www.finanzen.ch,,,German
2025-10-28T10:15:00+00:00,2025-10-28,"BitMine наращивает Ethereum - резервы до $13 , 7 млрд , стремясь стать крупнейшим держателем криптовалюты",https://sgzt.com/bitmine-%D0%BD%D0%B0%D1%80%D0%B0%D1%89%D0%B8%D0%B2%D0%B0%D0%B5%D1%82-ethereum-%D1%80%D0%B5%D0%B7%D0%B5%D1%80%D0%B2%D1%8B-%D0%B4%D0%BE-137-%D0%BC%D0%BB%D1%80%D0%B4-%D1%81%D1%82%D1%80%D0%B5%D0%BC/,sgzt.com,,,Russian
2025-10-28T00:45:00+00:00,2025-10-28,Stablecoins Power Billions in Payments . One in Ten Could Be Illicit,https://www.pymnts.com/cryptocurrency/2025/stablecoins-power-billions-in-payments-one-in-ten-could-be-illicit/,www.pymnts.com,,,English
2025-10-28T16:30:00+00:00,2025-10-28,"Solana News : Solana Flexes Huge Institutional Wins , SOL Hits $200+",https://finance.yahoo.com/news/solana-news-solana-flexes-huge-153920699.html,finance.yahoo.com,,,English
2025-10-28T16:00:00+00:00,2025-10-28,A stomach of steel : amateur investors ride out dips amid talk of an AI bubble | Investing,https://www.theguardian.com/business/2025/oct/28/amateur-investors-riding-out-dips-ai-bubble-stomach-steel,www.theguardian.com,,,English
2025-10-28T18:15:00+00:00,2025-10-28,Ședință calmă în piața valutar - monetară . Leul s - a apreciat modest,https://www.viata-libera.ro/economie/251870-sedinta-calma-in-piata-valutar-monetara-leul-s-a-apreciat-modest,www.viata-libera.ro,,,Romanian
2025-10-28T19:00:00+00:00,2025-10-28,More Crypto Deals Are  Inevitable  After FalconX Acquisition of 21Shares,https://finance.yahoo.com/news/more-crypto-deals-inevitable-falconx-100000551.html,finance.yahoo.com,,,English
2025-10-28T05:00:00+00:00,2025-10-28,Better Cryptocurrency Buy : Ethereum vs . Zcash,https://finance.yahoo.com/news/better-cryptocurrency-buy-ethereum-vs-171800949.html,finance.yahoo.com,,,English
2025-10-28T23:45:00+00:00,2025-10-28,"Heather  Razzlekhan  Morgan Release From Prison Wasnt Us , White House Says",https://www.coindesk.com/policy/2025/10/28/heather-razzlekhan-morgan-s-release-from-prison-wasn-t-us-white-house-says,www.coindesk.com,,,English
2025-10-28T03:45:00+00:00,2025-10-28,Delaware task force to consider adding nuclear energy,https://whyy.org/articles/delaware-nuclear-energy-task-force-small-modular-reactor/,whyy.org,,,English
2025-10-28T23:30:00+00:00,2025-10-28,North Korean Hackers Have Stolen Over $2 Billion This Year : Elliptic,https://www.coindesk.com/business/2025/10/06/north-korean-hackers-have-stolen-over-usd2-billion-in-2025-elliptic,www.coindesk.com,,,English
2025-10-28T03:45:00+00:00,2025-10-28,พิชัย จี้รัฐบาลอนุทิน แจงปมข้อตกลงแรร์เอิร์ธกับสหรัฐ,https://www.posttoday.com/politics/domestic/732504,www.posttoday.com,,,Thai
2025-10-28T06:15:00+00:00,2025-10-28,XRP Price Prediction : Consolidation Persists Bulls Need Fresh Push For Breakout,https://www.newsbtc.com/analysis/xrp/xrp-price-prediction-consolidation-2-550/,www.newsbtc.com,,,English
2025-10-28T06:15:00+00:00,2025-10-28,Ethereum Supported On Dips Buyers Build Strength For Next Leg Higher,https://www.newsbtc.com/analysis/eth/ethereum-supported-on-dips-4050/,www.newsbtc.com,,,English
2025-10-28T06:15:00+00:00,2025-10-28,Dogecoin ( DOGE ) Cools Off Buyers Struggle To Sustain Recovery Above Key Levels,https://www.newsbtc.com/analysis/doge/dogecoin-doge-cools-off-0-20/,www.newsbtc.com,,,English
2025-10-28T11:45:00+00:00,2025-10-28,9 ทิศทาง Bitkub  ท๊อป จิรายุส  ชู AI - Longevity เคลื่อนไทยสู่โลกอนาคต,https://www.bangkokbiznews.com/finance/cryptocurrency/1204729,www.bangkokbiznews.com,,,Thai
2025-10-28T20:30:00+00:00,2025-10-28,"SharpLink to Deploy $200M ETH on Linea via ether . fi , EigenCloud",https://www.coinspeaker.com/sharplink-allocates-200-million-ethereum-via-linea-etherfi-eigencloud/,www.coinspeaker.com,,,English
2025-10-28T04:00:00+00:00,2025-10-28,"Bitcoin , Ethereum , Dogecoin , XRP Drop As Rate Cut Bets Increase : Analyst Expects  Fast Move  To The Upside For ETH If Bulls Reclaim This Zone",https://biztoc.com/x/ff1d7574384035dd,biztoc.com,,,English
2025-10-28T21:00:00+00:00,2025-10-28,Cryptocurrency Mortgages and the Future of Home Loans,https://www.financial-news.co.uk/cryptocurrency-mortgages-explained/,www.financial-news.co.uk,,,English
2025-10-28T12:15:00+00:00,2025-10-28,Nasdaq - Listed Healthcare Company Prenetics Secures $48M to Boost Bitcoin Treasury Strategy,https://biztoc.com/x/1dac92b252f20739,biztoc.com,,,English
2025-10-28T23:15:00+00:00,2025-10-28,"La Bolsa española alcanza un nuevo máximo histórico al cierre tras subir el 0 , 54 %",https://www.publico.es/economia/bolsa-espanola-alcanza-nuevo-maximo-historico-cierre-subir-0-54.html,www.publico.es,,,Spanish
2025-10-28T22:45:00+00:00,2025-10-28,Pay with Crypto | Crypto POS System,https://www.skytab.com:443/features/pay-with-crypto,www.skytab.com:443,,,English
2025-10-28T22:30:00+00:00,2025-10-28,Börse Express - Bitcoin : Allzeithoch erobert !,https://www.boerse-express.com/news/articles/bitcoin-allzeithoch-erobert-836766,www.boerse-express.com,,,German
2025-10-28T03:45:00+00:00,2025-10-28,自由開講 》《 回魂計 》 真實版 太子集團案衝擊亞洲金融監理,https://talk.ltn.com.tw/article/breakingnews/5218890,talk.ltn.com.tw,,,Chinese
2025-10-28T08:45:00+00:00,2025-10-28,"Vén bức màn về vợ trùm lừa đảo Chen Zhi :  Tiên nữ Douyin , hotgirl khoe giàu nổi tiếng Trung Quốc",https://baomoi.com/ven-buc-man-ve-vo-trum-lua-dao-chen-zhi-tien-nu-douyin-hotgirl-khoe-giau-noi-tieng-trung-quoc-c53606671.epi,baomoi.com,,,Vietnamese
2025-10-28T19:45:00+00:00,2025-10-28,Krypto - Rallye im Oktober : Ethereum und Bitcoin erholen sich nach turbulenten Wochen,https://www.finanznachrichten.de/nachrichten-2025-10/66816197-krypto-rallye-im-oktober-ethereum-und-bitcoin-erholen-sich-nach-turbulenten-wochen-303.htm,www.finanznachrichten.de,,,German
2025-10-28T19:45:00+00:00,2025-10-28,"Hedera Kurs schießt 15 , 63 % auf über 0 , 20 $ - das steckt hinter dem Boom",https://www.finanznachrichten.de/nachrichten-2025-10/66816199-hedera-kurs-schiesst-15-63-auf-ueber-0-20-dollar-das-steckt-hinter-dem-boom-303.htm,www.finanznachrichten.de,,,German
2025-10-28T08:45:00+00:00,2025-10-28,"CoinShares Fund Flows : Inflows Of US$921m , Supported By Improving Investor Confidence",https://mondovisione.com/media-and-resources/news/coinshares-fund-flows-inflows-of-us921m-supported-by-improving-investor-confi-20251028/,mondovisione.com,,,English
2025-10-28T10:00:00+00:00,2025-10-28,Klever Blockchain Introduces new update of KVM for Secure and Scalable Smart Contract Execution,https://www.manilatimes.net/2025/10/28/tmt-newswire/globenewswire/klever-blockchain-introduces-new-update-of-kvm-for-secure-and-scalable-smart-contract-execution/2209772,www.manilatimes.net,,,English
2025-10-28T11:00:00+00:00,2025-10-28,Four Major ETFs Start Trading This Week : Why This Could Rally the Market and Best Wallet Token,https://bravenewcoin.com/partner/four-etfs-launch-best-wallet-token-could-rally,bravenewcoin.com,,,English
2025-10-28T00:15:00+00:00,2025-10-28,Here Why Hiring Is Slowing In The U . S .,https://seekingalpha.com/article/4833595-heres-why-hiring-is-slowing-in-the-u-s,seekingalpha.com,,,English
2025-10-28T04:00:00+00:00,2025-10-28,AI 전용 엔진룸  짓는 기업 … 엔비디아 투자받고 델 · HP 손잡아 [ 유중호의 미국 주식 플렉스 ],https://www.munhwa.com:443/article/11542409,www.munhwa.com:443,,,Korean
2025-10-28T23:45:00+00:00,2025-10-28,UAE Ultra - Rich Are Driving a Fierce Crypto Revolution in Private Banking,https://www.coindesk.com/business/2025/10/28/wealth-managers-scramble-to-add-crypto-as-uae-s-ultra-rich-demand-digital-assets,www.coindesk.com,,,English
2025-10-28T10:00:00+00:00,2025-10-28,US concern as Whitehouse found listed on Rightmove,https://www.newsbiscuit.com/post/us-concern-as-whitehouse-found-listed-on-rightmove,www.newsbiscuit.com,,,English
2025-10-28T21:15:00+00:00,2025-10-28,"Blockchain+ Bi - Weekly While Washington Shuts Down , The Industry Moves Forward",https://www.mondaq.com:443/unitedstates/fin-tech/1697088/blockchain+-bi-weekly-while-washington-shuts-down-the-industry-moves-forward,www.mondaq.com:443,,,English
2025-10-28T08:45:00+00:00,2025-10-28,Best Crypto Staking Platforms & Highest APY Rates,https://ventureburn.com/best-crypto-staking-platforms/,ventureburn.com,,,English
2025-10-28T00:00:00+00:00,2025-10-28,"1 New Reason to Buy Solana Right Now , and 1 Reason to Be Cautious",https://www.fool.com/investing/2025/10/27/1-new-reason-to-buy-solana-right-now-and-1-reason/?source=iedfolrf0000001,www.fool.com,,,English
2025-10-28T08:00:00+00:00,2025-10-28,"HTX Select Q3 Report : 38 Listings Shine , Leading the Next Market Cycle with a Proven Selection Strategy",https://www.finanznachrichten.de/nachrichten-2025-10/66807121-htx-select-q3-report-38-listings-shine-leading-the-next-market-cycle-with-a-proven-selection-strategy-008.htm,www.finanznachrichten.de,,,English
2025-10-28T17:30:00+00:00,2025-10-28,Luxxfolio Holdings Inc .: Luxxfolio Celebrates Listing of Canary Capital LTC ETF,https://www.finanznachrichten.de/nachrichten-2025-10/66815268-luxxfolio-holdings-inc-luxxfolio-celebrates-listing-of-canary-capital-s-ltc-etf-signals-new-era-for-litecoin-296.htm,www.finanznachrichten.de,,,English
2025-10-28T22:30:00+00:00,2025-10-28,قناة النيل للأخبار | BitStarz Terms of service and People in america,https://www.nile.eg/bitstarz-terms-of-service-and-people-in-america,www.nile.eg,,,English
2025-10-28T20:30:00+00:00,2025-10-28,Meenutusi majanduskonverentsilt Tuleviku Foorum : miks on Gary Stevensoni idee oluline,https://www.telegram.ee/eesti/meenutusi-majanduskonverentsilt-tuleviku-foorum-miks-on-gary-stevensoni-idee-oluline,www.telegram.ee,,,Estonian
2025-10-28T12:15:00+00:00,2025-10-28,Halloween Spooktacular : Jaw - Dropping Bonuses and Haunting Games,https://www.onlinecasinoreports.com/articles/halloween-spooktacular-jaw-dropping-bonuses-and-haunting-games.php,www.onlinecasinoreports.com,,,English
2025-10-28T01:45:00+00:00,2025-10-28,Trenton mayor plans open meeting on SNAP shutdown crisis,https://www.kttn.com/trenton-mayor-plans-open-meeting-on-snap-shutdown-crisis/,www.kttn.com,,,English
2025-10-28T00:45:00+00:00,2025-10-28,"[ 글로벌마켓 모닝 브리핑 ] 뉴욕증시 , 미 · 중 정상회담 기대에 사상 최고치 … 금값 , 2 . 9 % ↓",https://www.etoday.co.kr/news/view/2518943,www.etoday.co.kr,,,Korean
2025-10-28T23:45:00+00:00,2025-10-28,Stocks Rally on US - China Preliminary Trade Agreement,https://finance.yahoo.com/news/stocks-rally-us-china-preliminary-155042508.html,finance.yahoo.com,,,English
2025-10-28T00:00:00+00:00,2025-10-28,Racer Aeziah Divine Seeking Sponsorship,https://bernews.com/2025/10/oct27-aeziah-divine-seeking-sponsorship/,bernews.com,,,English
2025-10-28T01:30:00+00:00,2025-10-28,Vanderbilt Blockchain craze : Record cohort renews push for course credit – The Vanderbilt Hustler,https://vanderbilthustler.com/2025/10/27/vanderbilt-blockchains-craze-record-cohort-renews-push-for-course-credit/,vanderbilthustler.com,,,English
2025-10-28T22:45:00+00:00,2025-10-28,Key Takeaways - From Web3 to Wall Street : Fundamentals of the Digital Asset Treasury Model in the Crypto Era | Fenwick & West LLP,https://www.jdsupra.com/legalnews/key-takeaways-from-web3-to-wall-street-2544585/,www.jdsupra.com,,,English
2025-10-28T22:15:00+00:00,2025-10-28,What is non - farm payroll ( NFP ): Is higher NFP good or bad ?,https://www.markets.com/education-centre/what-is-non-farm-payroll-nfp-is-higher-nfp-good-or-bad/,www.markets.com,,,English
2025-10-28T23:30:00+00:00,2025-10-28,S & P stuft MicroStrategy auf Ramschstatus herab,https://www.boersennews.de/nachrichten/partner/cryptopr/s-und-p-stuft-microstrategy-auf-ramschstatus-herab/4932174/,www.boersennews.de,,,German
2025-10-28T01:00:00+00:00,2025-10-28,Building Future Wealth : Why Learning Crypto Early Gives Students an Edge,https://www.idsnews.com/article/2025/10/sponsored-building-future-wealth-102725,www.idsnews.com,,,English
2025-10-28T22:15:00+00:00,2025-10-28,Semler Scientific® to Release Third Quarter 2025 Financial Results,https://www.itnewsonline.com/PRNewswire/Semler-Scientific-to-Release-Third-Quarter-2025-Financial-Results/1090205,www.itnewsonline.com,,,English
2025-10-28T12:15:00+00:00,2025-10-28,5 Features to Look for in a Money App for Your Teen,https://www.cnbc.com/select/5-features-to-look-for-in-a-money-app-for-your-teen/,www.cnbc.com,,,English
2025-10-28T05:00:00+00:00,2025-10-28,Что такое скины в Counter - Strike и почему они подешевели - 28 октября 2025,https://www.fontanka.ru/2025/10/28/76094033/,www.fontanka.ru,,,Russian
2025-10-29T00:00:00+00:00,2025-10-28,"[ 글로벌마켓 모닝 브리핑 ] 뉴욕증시 , 엔비디아發 AI 낙관론에 사상 최고치 … 금값 , 4000달러 밑돌아",https://www.etoday.co.kr/news/view/2519413,www.etoday.co.kr,,,Korean
2025-10-28T20:00:00+00:00,2025-10-28,"Alberta UCP members want to debate policies around Bitcoin , mRNA vaccines , separation and more",https://calgarysun.com/news/exclusive-alberta-ucp-members-want-to-debate-policies-around-bitcoin-mrna-vaccines-separation-and-more/wcm/6967a8e4-0d7f-4ad5-8cad-7bf6ac37101f,calgarysun.com,,,English
2025-10-28T10:15:00+00:00,2025-10-28,חוק מילצ  ן מבוטל : מה משתנה לעולים החל מ - 2026 ?,https://www.mako.co.il/finances-money/Article-adae47f6ed92a91026.htm,www.mako.co.il,,,Hebrew
2025-10-28T23:30:00+00:00,2025-10-28,"AI is gobbling up power and money - and sidelining this big issue , Blackstone and BlackRock CEOs say",https://www.morningstar.com/news/marketwatch/2025102846/ai-is-gobbling-up-power-and-money-and-sidelining-this-big-issue-blackstone-and-blackrock-ceos-say,www.morningstar.com,,,English
2025-10-28T01:00:00+00:00,2025-10-28,倫敦手機盜竊激增 警匪大戰融入全新技術手段 - BBC News 中文,https://www.bbc.com/zhongwen/articles/cdegzrj6np0o/trad,www.bbc.com,,,Chinese
2025-10-28T17:45:00+00:00,2025-10-28,Best Crypto Payment Gateways for 2025 : Top 5 Compared,https://www.banklesstimes.com/articles/2025/10/28/best-crypto-payment-gateways-for-2025-top-5-compared/,www.banklesstimes.com,,,English
2025-10-28T17:00:00+00:00,2025-10-28,"eToro : Investitorii români şi globali mizează pe AI , roboţi şi cripto",https://www.bursa.ro/etoro-investitorii-romani-si-globali-mizeaza-pe-ai-roboti-si-cripto-08424750,www.bursa.ro,,,Romanian
2025-10-28T23:45:00+00:00,2025-10-28,What Makes a Broker Regulated and Why It Matters,https://www.thecork.ie/2025/10/28/what-makes-a-broker-regulated-and-why-it-matters/,www.thecork.ie,,,English
2025-10-28T09:00:00+00:00,2025-10-28,Jak inwestować żeby pomnażać oszczędności i nie stracić w razie kryzysu ? - Forbes Polska,https://www.forbes.pl/jak-inwestowac-zeby-pomnazac-oszczednosci-i-nie-stracic-w-razie-kryzysu/11lhzhr,www.forbes.pl,,,Polish
2025-10-28T11:45:00+00:00,2025-10-28,Mixed Sentiment In World Markets,https://www.rttnews.com/3586656/mixed-sentiment-in-world-markets.aspx,www.rttnews.com,,,English
2025-10-28T01:45:00+00:00,2025-10-28,"Mercados al alza : Wall Street , peso y criptomonedas suben ante cumbre Trump - Xi",https://lajornadasanluis.com.mx/mercados-al-alza-wall-street-peso-y-criptomonedas-suben-ante-cumbre-trump-xi/,lajornadasanluis.com.mx,,,Spanish
2025-10-28T04:00:00+00:00,2025-10-28,US dollar slips as trade optimism boosts risk appetite | Hellenic Shipping News Worldwide,https://www.hellenicshippingnews.com/us-dollar-slips-as-trade-optimism-boosts-risk-appetite/,www.hellenicshippingnews.com,,,English
2025-10-28T22:45:00+00:00,2025-10-28,"The Payments Newsletter including Digital Assets & Blockchain , October 2025 | Hogan Lovells",https://www.jdsupra.com/legalnews/the-payments-newsletter-including-9617359/,www.jdsupra.com,,,English
2025-10-28T11:30:00+00:00,2025-10-28,"AI Slopping the Hogs with Elon Musk , the UFC , & Binance in the Gulf",https://www.nakedcapitalism.com/2025/10/ai-slop-trump-elon-musk-saudi-arabia-uae-ufc-dubai-ai-slop.html,www.nakedcapitalism.com,,,English
2025-10-28T19:45:00+00:00,2025-10-28,"Alberta UCP members want to debate policies around Bitcoin , mRNA vaccines , separation and more",https://www.edmontonexaminer.com:443/news/exclusive-alberta-ucp-members-want-to-debate-policies-around-bitcoin-mrna-vaccines-separation-and-more/wcm/8064488f-bcad-4476-904b-f9134acbec7e,www.edmontonexaminer.com:443,,,English
2025-10-28T18:45:00+00:00,2025-10-28,Luxxfolio Celebrates Listing of Canary Capital LTC ETF - Signals New Era for Litecoin,https://www.cantechletter.com/newswires/luxxfolio-celebrates-listing-of-canary-capitals-ltc-etf-signals-new-era-for-litecoin/,www.cantechletter.com,,,English
2025-10-28T02:15:00+00:00,2025-10-28,The Diminishing of America,https://slguardian.org/the-diminishing-of-america/,slguardian.org,,,English
2025-10-28T06:00:00+00:00,2025-10-28,Mərkəzi Avrasiyanın yeni memarlığı : nəqliyyat dəhlizlərindən gələcəyin strateji bağlarına,https://az.trend.az/azerbaijan/politics/4109582.html,az.trend.az,,,Azerbaijani
2025-10-28T18:15:00+00:00,2025-10-28,قناة النيل للأخبار | bet365 Incentive Code : Rating $2 hundred using password Talks about 2025,https://www.nile.eg/bet365-incentive-code-rating-2-hundred-using-password-talks-about-2025,www.nile.eg,,,English
2025-10-28T00:45:00+00:00,2025-10-28,MOZAIC ȘTIRI ECONOMICE : Boierii de la stat nu au limite,https://www.ziaruldevrancea.ro/special/economic/mozaic-Stiri-economice-boierii-de-la-stat-nu-au-limite,www.ziaruldevrancea.ro,,,Romanian
2025-10-28T10:15:00+00:00,2025-10-28,Официальный сайт гэмблинга : от регистрации до обналичивания выигрыша,https://www.caghaber.com/ofitsialnyj-sajt-gemblinga-ot-registratsii-do-obnalichivanija-vyigrysha/,www.caghaber.com,,,Russian
2025-10-28T10:15:00+00:00,2025-10-28,Азартный клуб с немедленными выводами средств : всесторонний анализ,https://www.caghaber.com/azartnyj-klub-s-nemedlennymi-vyvodami-sredstv-vsestoronnij-analiz/,www.caghaber.com,,,Russian
2025-10-28T02:45:00+00:00,2025-10-28,The availability of future revolution,https://sofiaglobe.com/2025/10/27/the-availability-of-future-revolution/,sofiaglobe.com,,,English
